{
  "api_version": "proof.dev/conformance/ed25519-dsse-vector/v1",
  "status": "proposed",
  "payload_file": "binding-enrollment-challenge.payload.valid.json",
  "envelope_file": "binding-enrollment-challenge.envelope.valid.json",
  "payload_type": "application/vnd.proof.binding-enrollment-challenge.v1+json",
  "payload_utf8_base64": "eyJhcGlfdmVyc2lvbiI6InByb29mLmRldi9iaW5kaW5nLWVucm9sbG1lbnQtY2hhbGxlbmdlL3YxIiwiYXVkaWVuY2UiOiJwcm9vZjovL3dvcmtzcGFjZS8wMTljMDAwMC0wMDAwLTcwMDAtODAwMC0wMDAwMDAwMDAwMDEiLCJiaW5kaW5nX2lkIjoiMDE5YzAwMDAtMDAwMC03MDAwLTgwMDAtMDAwMDAwMDAwMDA0IiwiY2FuZGlkYXRlX2tleV9pZCI6ImVkMjU1MTk6NzA3ZThmZjZlNGJkNDQyOWE1MmE1Njg3ZmQ1ZGRhZDEwMjM4NjNhZWI2Y2NkZDYxMzQyMjk1NjY5YWQ1NjdmYyIsImNoYWxsZW5nZV9pZCI6IjAxOWMwMDAwLTAwMDAtNzAwMC04MDAwLTAwMDAwMDAwMDAwNyIsImV4cGlyZXNfYXQiOiIyMDI2LTA4LTE3VDIwOjA0OjAwWiIsImlzc3VlZF9hdCI6IjIwMjYtMDgtMTdUMTk6NTk6MDBaIiwiaXNzdWVkX2J5X3ByaW5jaXBhbF9pZCI6IjAxOWMwMDAwLTAwMDAtNzAwMC04MDAwLTAwMDAwMDAwMDAwMiIsInByaW5jaXBhbF9pZCI6IjAxOWMwMDAwLTAwMDAtNzAwMC04MDAwLTAwMDAwMDAwMDAwMyIsIndvcmtzcGFjZV9pZCI6IjAxOWMwMDAwLTAwMDAtNzAwMC04MDAwLTAwMDAwMDAwMDAwMSJ9",
  "pae_utf8_base64": "RFNTRXYxIDU4IGFwcGxpY2F0aW9uL3ZuZC5wcm9vZi5iaW5kaW5nLWVucm9sbG1lbnQtY2hhbGxlbmdlLnYxK2pzb24gNTcwIHsiYXBpX3ZlcnNpb24iOiJwcm9vZi5kZXYvYmluZGluZy1lbnJvbGxtZW50LWNoYWxsZW5nZS92MSIsImF1ZGllbmNlIjoicHJvb2Y6Ly93b3Jrc3BhY2UvMDE5YzAwMDAtMDAwMC03MDAwLTgwMDAtMDAwMDAwMDAwMDAxIiwiYmluZGluZ19pZCI6IjAxOWMwMDAwLTAwMDAtNzAwMC04MDAwLTAwMDAwMDAwMDAwNCIsImNhbmRpZGF0ZV9rZXlfaWQiOiJlZDI1NTE5OjcwN2U4ZmY2ZTRiZDQ0MjlhNTJhNTY4N2ZkNWRkYWQxMDIzODYzYWViNmNjZGQ2MTM0MjI5NTY2OWFkNTY3ZmMiLCJjaGFsbGVuZ2VfaWQiOiIwMTljMDAwMC0wMDAwLTcwMDAtODAwMC0wMDAwMDAwMDAwMDciLCJleHBpcmVzX2F0IjoiMjAyNi0wOC0xN1QyMDowNDowMFoiLCJpc3N1ZWRfYXQiOiIyMDI2LTA4LTE3VDE5OjU5OjAwWiIsImlzc3VlZF9ieV9wcmluY2lwYWxfaWQiOiIwMTljMDAwMC0wMDAwLTcwMDAtODAwMC0wMDAwMDAwMDAwMDIiLCJwcmluY2lwYWxfaWQiOiIwMTljMDAwMC0wMDAwLTcwMDAtODAwMC0wMDAwMDAwMDAwMDMiLCJ3b3Jrc3BhY2VfaWQiOiIwMTljMDAwMC0wMDAwLTcwMDAtODAwMC0wMDAwMDAwMDAwMDEifQ==",
  "envelope_digest": "blake3:9e14e11582aa0f9b94b1060832b6a09b52b81192fb215df5d0a590dfe0304653",
  "envelope_digest_context": "proof:binding-enrollment-envelope:v1",
  "signers": [
    {
      "key_id": "ed25519:707e8ff6e4bd4429a52a5687fd5ddad1023863aeb6ccdd61342295669ad567fc",
      "public_key_hex": "707e8ff6e4bd4429a52a5687fd5ddad1023863aeb6ccdd61342295669ad567fc",
      "public_key_base64": "cH6P9uS9RCmlKlaH/V3a0QI4Y662zN1hNCKVZprVZ/w=",
      "signature_hex": "190689c4b5f3e9c489760005286f0ecff8dad609eb8b5d5bb476926b0742305011a4493a17a125f302afcf68fbe622eefa480fd630ab6e9eb33f25339948850f",
      "signature_base64": "GQaJxLXz6cSJdgAFKG8Oz/ja1gnri11btHaSawdCMFARpEk6F6El8wKvz2j75iLu+kgP1jCrbp6zPyUzmUiFDw=="
    }
  ]
}
