{
  "api_version": "proof.dev/conformance/ed25519-dsse-vector/v1",
  "status": "proposed",
  "payload_file": "workspace-authority-root-transition.payload.valid.json",
  "envelope_file": "workspace-authority-root-transition.envelope.valid.json",
  "payload_type": "application/vnd.proof.workspace-authority-root-transition.v1+json",
  "payload_utf8_base64": "eyJhY3RpdmF0ZWRfYXQiOiIyMDI2LTA4LTE3VDIwOjEwOjAwWiIsImFjdGl2YXRlZF9ieV9wcmluY2lwYWxfaWQiOiIwMTljMDAwMC0wMDAwLTcwMDAtODAwMC0wMDAwMDAwMDAwMDIiLCJhbGdvcml0aG0iOiJlZDI1NTE5IiwiYXBpX3ZlcnNpb24iOiJwcm9vZi5kZXYvd29ya3NwYWNlLWF1dGhvcml0eS1yb290LXRyYW5zaXRpb24vdjEiLCJhdXRob3JpdHlfc2VxdWVuY2UiOjksInByZWRlY2Vzc29yX2F1dGhvcml0eV9rZXlfaWQiOiJlZDI1NTE5OjI0N2I5ZmZjMzk1ZDE5YTU1MTg4OTcwNWE5M2M3Y2I0NjZhNGI1YWVhOWUzMTVmOTc0YjdiNDZkYmU3Zjk0NTMiLCJwcmV2aW91c19hdXRob3JpdHlfcmVjb3JkX2RpZ2VzdCI6ImJsYWtlMzpmMzQ5M2M4ZTVjZDZlYTVhMTY1ZWU5ZDU2ZWFkNmYxY2M2MGFmNmM1NTE1YmRhZDk5M2U3YjcwNjBkNGUyODA4Iiwic3VjY2Vzc29yX2F1dGhvcml0eV9rZXlfaWQiOiJlZDI1NTE5OmM4MWY0YWUzM2M5YjYzMWVkNmVhNTA3YzEwODNlYWZkNGIyYjZjYzg5YjVmZWFhZTRiNTcwMmMxNDU5MWVhMmUiLCJzdWNjZXNzb3JfcHVibGljX2tleSI6InlCOUs0enliWXg3VzZsQjhFSVBxL1VzcmJNaWJYK3F1UzFjQ3dVV1I2aTQ9IiwidHJhbnNpdGlvbl9pZCI6IjAxOWMwMDAwLTAwMDAtNzAwMC04MDAwLTAwMDAwMDAwMDAxMyIsIndvcmtzcGFjZV9pZCI6IjAxOWMwMDAwLTAwMDAtNzAwMC04MDAwLTAwMDAwMDAwMDAwMSJ9",
  "pae_utf8_base64": "RFNTRXYxIDY1IGFwcGxpY2F0aW9uL3ZuZC5wcm9vZi53b3Jrc3BhY2UtYXV0aG9yaXR5LXJvb3QtdHJhbnNpdGlvbi52MStqc29uIDcxNCB7ImFjdGl2YXRlZF9hdCI6IjIwMjYtMDgtMTdUMjA6MTA6MDBaIiwiYWN0aXZhdGVkX2J5X3ByaW5jaXBhbF9pZCI6IjAxOWMwMDAwLTAwMDAtNzAwMC04MDAwLTAwMDAwMDAwMDAwMiIsImFsZ29yaXRobSI6ImVkMjU1MTkiLCJhcGlfdmVyc2lvbiI6InByb29mLmRldi93b3Jrc3BhY2UtYXV0aG9yaXR5LXJvb3QtdHJhbnNpdGlvbi92MSIsImF1dGhvcml0eV9zZXF1ZW5jZSI6OSwicHJlZGVjZXNzb3JfYXV0aG9yaXR5X2tleV9pZCI6ImVkMjU1MTk6MjQ3YjlmZmMzOTVkMTlhNTUxODg5NzA1YTkzYzdjYjQ2NmE0YjVhZWE5ZTMxNWY5NzRiN2I0NmRiZTdmOTQ1MyIsInByZXZpb3VzX2F1dGhvcml0eV9yZWNvcmRfZGlnZXN0IjoiYmxha2UzOmYzNDkzYzhlNWNkNmVhNWExNjVlZTlkNTZlYWQ2ZjFjYzYwYWY2YzU1MTViZGFkOTkzZTdiNzA2MGQ0ZTI4MDgiLCJzdWNjZXNzb3JfYXV0aG9yaXR5X2tleV9pZCI6ImVkMjU1MTk6YzgxZjRhZTMzYzliNjMxZWQ2ZWE1MDdjMTA4M2VhZmQ0YjJiNmNjODliNWZlYWFlNGI1NzAyYzE0NTkxZWEyZSIsInN1Y2Nlc3Nvcl9wdWJsaWNfa2V5IjoieUI5SzR6eWJZeDdXNmxCOEVJUHEvVXNyYk1pYlgrcXVTMWNDd1VXUjZpND0iLCJ0cmFuc2l0aW9uX2lkIjoiMDE5YzAwMDAtMDAwMC03MDAwLTgwMDAtMDAwMDAwMDAwMDEzIiwid29ya3NwYWNlX2lkIjoiMDE5YzAwMDAtMDAwMC03MDAwLTgwMDAtMDAwMDAwMDAwMDAxIn0=",
  "envelope_digest": "blake3:a04cdd5629f3db1a9fbddaf097ce86d68cbb53dd47e26ae5bd757f93e1afc045",
  "envelope_digest_context": "proof:authority-record-envelope:v1",
  "signers": [
    {
      "key_id": "ed25519:247b9ffc395d19a551889705a93c7cb466a4b5aea9e315f974b7b46dbe7f9453",
      "public_key_hex": "247b9ffc395d19a551889705a93c7cb466a4b5aea9e315f974b7b46dbe7f9453",
      "public_key_base64": "JHuf/DldGaVRiJcFqTx8tGakta6p4xX5dLe0bb5/lFM=",
      "signature_hex": "f94c91136943d5be87d8c0079ee701c63ed6eb8ce553f6853b04a6d6adb23c78ca9e6bc23e61625ebfb1f1a206f05bdb9dbddf41374783fac1c88b0cfeac3300",
      "signature_base64": "+UyRE2lD1b6H2MAHnucBxj7W64zlU/aFOwSm1q2yPHjKnmvCPmFiXr+x8aIG8Fvbnb3fQTdHg/rByIsM/qwzAA=="
    },
    {
      "key_id": "ed25519:c81f4ae33c9b631ed6ea507c1083eafd4b2b6cc89b5feaae4b5702c14591ea2e",
      "public_key_hex": "c81f4ae33c9b631ed6ea507c1083eafd4b2b6cc89b5feaae4b5702c14591ea2e",
      "public_key_base64": "yB9K4zybYx7W6lB8EIPq/UsrbMibX+quS1cCwUWR6i4=",
      "signature_hex": "3d7f0dd801ba533613f71576ac2bfd079d14cc9910b9f16641cc95896b22c4e0ddff2707a66ce1ec960c03b2dcae93266c9d20c529dcae2e4f90d795eeed9a03",
      "signature_base64": "PX8N2AG6UzYT9xV2rCv9B50UzJkQufFmQcyViWsixODd/ycHpmzh7JYMA7LcrpMmbJ0gxSncri5PkNeV7u2aAw=="
    }
  ]
}
