{
  "api_version": "proof.dev/conformance/ed25519-dsse-vector/v1",
  "status": "proposed",
  "payload_file": "authenticated-command.payload.valid.json",
  "envelope_file": "authenticated-command.envelope.valid.json",
  "payload_type": "application/vnd.proof.authenticated-command.v1+json",
  "payload_utf8_base64": "eyJhcGlfdmVyc2lvbiI6InByb29mLmRldi9hdXRoZW50aWNhdGVkLWNvbW1hbmQvdjEiLCJhdWRpZW5jZSI6InByb29mOi8vd29ya3NwYWNlLzAxOWMwMDAwLTAwMDAtNzAwMC04MDAwLTAwMDAwMDAwMDAwMSIsImJpbmRpbmdfaWQiOiIwMTljMDAwMC0wMDAwLTcwMDAtODAwMC0wMDAwMDAwMDAwMDQiLCJjb21tYW5kX2RpZ2VzdCI6ImJsYWtlMzoyZTRlNjFmYjkxNjhiNTEyNDA3MjNiODZjNWFkN2E4YjZjNzc3ZTU1NjIzNDVhODM1MTc2ZWQ1MTVkNTI5ODBhIiwiZGVsZWdhdGlvbl9pZCI6IjAxOWMwMDAwLTAwMDAtNzAwMC04MDAwLTAwMDAwMDAwMDAwNSIsImV4cGlyZXNfYXQiOiIyMDI2LTA4LTE3VDIwOjA3OjAwWiIsImlkZW1wb3RlbmN5X2tleSI6bnVsbCwiaXNzdWVkX2F0IjoiMjAyNi0wOC0xN1QyMDowMjowMFoiLCJvcGVyYXRpbmdfcHJpbmNpcGFsX2lkIjoiMDE5YzAwMDAtMDAwMC03MDAwLTgwMDAtMDAwMDAwMDAwMDAzIiwib3BlcmF0aW9uIjp7Im5hbWUiOiJ3b3Jrc3BhY2Uuc3RhdHVzIiwidmVyc2lvbiI6InByb29mLmRldi9vcGVyYXRpb24vd29ya3NwYWNlLnN0YXR1cy92MSJ9LCJwcmVzZW50YXRpb25faWQiOiIwMTljMDAwMC0wMDAwLTcwMDAtODAwMC0wMDAwMDAwMDAwMDYiLCJyZXF1ZXN0aW5nX3ByaW5jaXBhbF9pZCI6IjAxOWMwMDAwLTAwMDAtNzAwMC04MDAwLTAwMDAwMDAwMDAwMiIsIndvcmtzcGFjZV9pZCI6IjAxOWMwMDAwLTAwMDAtNzAwMC04MDAwLTAwMDAwMDAwMDAwMSJ9",
  "pae_utf8_base64": "RFNTRXYxIDUxIGFwcGxpY2F0aW9uL3ZuZC5wcm9vZi5hdXRoZW50aWNhdGVkLWNvbW1hbmQudjEranNvbiA3NDQgeyJhcGlfdmVyc2lvbiI6InByb29mLmRldi9hdXRoZW50aWNhdGVkLWNvbW1hbmQvdjEiLCJhdWRpZW5jZSI6InByb29mOi8vd29ya3NwYWNlLzAxOWMwMDAwLTAwMDAtNzAwMC04MDAwLTAwMDAwMDAwMDAwMSIsImJpbmRpbmdfaWQiOiIwMTljMDAwMC0wMDAwLTcwMDAtODAwMC0wMDAwMDAwMDAwMDQiLCJjb21tYW5kX2RpZ2VzdCI6ImJsYWtlMzoyZTRlNjFmYjkxNjhiNTEyNDA3MjNiODZjNWFkN2E4YjZjNzc3ZTU1NjIzNDVhODM1MTc2ZWQ1MTVkNTI5ODBhIiwiZGVsZWdhdGlvbl9pZCI6IjAxOWMwMDAwLTAwMDAtNzAwMC04MDAwLTAwMDAwMDAwMDAwNSIsImV4cGlyZXNfYXQiOiIyMDI2LTA4LTE3VDIwOjA3OjAwWiIsImlkZW1wb3RlbmN5X2tleSI6bnVsbCwiaXNzdWVkX2F0IjoiMjAyNi0wOC0xN1QyMDowMjowMFoiLCJvcGVyYXRpbmdfcHJpbmNpcGFsX2lkIjoiMDE5YzAwMDAtMDAwMC03MDAwLTgwMDAtMDAwMDAwMDAwMDAzIiwib3BlcmF0aW9uIjp7Im5hbWUiOiJ3b3Jrc3BhY2Uuc3RhdHVzIiwidmVyc2lvbiI6InByb29mLmRldi9vcGVyYXRpb24vd29ya3NwYWNlLnN0YXR1cy92MSJ9LCJwcmVzZW50YXRpb25faWQiOiIwMTljMDAwMC0wMDAwLTcwMDAtODAwMC0wMDAwMDAwMDAwMDYiLCJyZXF1ZXN0aW5nX3ByaW5jaXBhbF9pZCI6IjAxOWMwMDAwLTAwMDAtNzAwMC04MDAwLTAwMDAwMDAwMDAwMiIsIndvcmtzcGFjZV9pZCI6IjAxOWMwMDAwLTAwMDAtNzAwMC04MDAwLTAwMDAwMDAwMDAwMSJ9",
  "envelope_digest": "blake3:22b87afb7ab79a116fbbc58a52452e47d9c8c332d491bd4ae9567f243cfd81d2",
  "envelope_digest_context": "proof:authenticated-command-envelope:v1",
  "signers": [
    {
      "key_id": "ed25519:707e8ff6e4bd4429a52a5687fd5ddad1023863aeb6ccdd61342295669ad567fc",
      "public_key_hex": "707e8ff6e4bd4429a52a5687fd5ddad1023863aeb6ccdd61342295669ad567fc",
      "public_key_base64": "cH6P9uS9RCmlKlaH/V3a0QI4Y662zN1hNCKVZprVZ/w=",
      "signature_hex": "db7d6ca9c95c36371a7f79758033e260a21e39ff9b96a84e517b36b0db0406746b349de5e72fae2b6f077e6ff9e8bfafac357bed1a7932d317b0b9e8ddefcd0e",
      "signature_base64": "231sqclcNjcaf3l1gDPiYKIeOf+blqhOUXs2sNsEBnRrNJ3l5y+uK28Hfm/56L+vrDV77Rp5MtMXsLno3e/NDg=="
    }
  ]
}
