{
  "api_version": "proof.dev/conformance/ed25519-dsse-vector/v1",
  "status": "proposed",
  "payload_file": "principal-binding.valid.json",
  "envelope_file": "principal-binding.authority-envelope.valid.json",
  "payload_type": "application/vnd.proof.authority-record.v1+json",
  "payload_utf8_base64": "eyJhbGdvcml0aG0iOiJlZDI1NTE5IiwiYXBpX3ZlcnNpb24iOiJwcm9vZi5kZXYvcHJpbmNpcGFsLWJpbmRpbmcvdjEiLCJhdWRpZW5jZSI6InByb29mOi8vd29ya3NwYWNlLzAxOWMwMDAwLTAwMDAtNzAwMC04MDAwLTAwMDAwMDAwMDAwMSIsImF1dGhlbnRpY2F0ZWRfc3ViamVjdCI6eyJhcGlfdmVyc2lvbiI6InByb29mLmRldi9hdXRoZW50aWNhdGVkLXN1YmplY3QvdjEiLCJwcm92aWRlciI6InByb29mL2xvY2FsLWVkMjU1MTkiLCJzdWJqZWN0IjoiZWQyNTUxOTo3MDdlOGZmNmU0YmQ0NDI5YTUyYTU2ODdmZDVkZGFkMTAyMzg2M2FlYjZjY2RkNjEzNDIyOTU2NjlhZDU2N2ZjIn0sImF1dGhvcml0eV9zZXF1ZW5jZSI6MywiYmluZGluZ19pZCI6IjAxOWMwMDAwLTAwMDAtNzAwMC04MDAwLTAwMDAwMDAwMDAwNCIsImVucm9sbG1lbnRfY2hhbGxlbmdlX2RpZ2VzdCI6ImJsYWtlMzo2N2JlNjY0MWI2Zjg4MzhmYjQxMTU4OTQ2YzgwZWNiNjg1NDQ1MjUyZDA1YjYzZGQ4OGIwNGQyODBmMzU0NWUxIiwiZW5yb2xsbWVudF9lbnZlbG9wZV9kaWdlc3QiOiJibGFrZTM6OWUxNGUxMTU4MmFhMGY5Yjk0YjEwNjA4MzJiNmEwOWI1MmI4MTE5MmZiMjE1ZGY1ZDBhNTkwZGZlMDMwNDY1MyIsImV4cGlyZXNfYXQiOiIyMDI2LTExLTE1VDIwOjAwOjAwWiIsImlzc3VlZF9hdCI6IjIwMjYtMDgtMTdUMjA6MDA6MDBaIiwiaXNzdWVkX2J5X3ByaW5jaXBhbF9pZCI6IjAxOWMwMDAwLTAwMDAtNzAwMC04MDAwLTAwMDAwMDAwMDAwMiIsImtleV91c2FnZSI6ImF1dGhlbnRpY2F0ZWQtY29tbWFuZCIsIm5vdF9iZWZvcmUiOiIyMDI2LTA4LTE3VDIwOjAwOjAwWiIsInByZXZpb3VzX2F1dGhvcml0eV9yZWNvcmRfZGlnZXN0IjoiYmxha2UzOjdkNzE2NjM3ZTdkN2ZkYTA2YjVjNTA5NjVlN2UzMDg3ZGNiYjE2YjUwMzY1YjgxOGM4YjhhNTVmNGJmMzlkZDQiLCJwcmluY2lwYWxfaWQiOiIwMTljMDAwMC0wMDAwLTcwMDAtODAwMC0wMDAwMDAwMDAwMDMiLCJwcmluY2lwYWxfdHlwZSI6ImFnZW50IiwicHVibGljX2tleSI6ImNINlA5dVM5UkNtbEtsYUgvVjNhMFFJNFk2NjJ6TjFoTkNLVlpwclZaL3c9Iiwic3VwZXJzZWRlc19iaW5kaW5nX2lkIjpudWxsLCJ3b3Jrc3BhY2VfaWQiOiIwMTljMDAwMC0wMDAwLTcwMDAtODAwMC0wMDAwMDAwMDAwMDEifQ==",
  "pae_utf8_base64": "RFNTRXYxIDQ2IGFwcGxpY2F0aW9uL3ZuZC5wcm9vZi5hdXRob3JpdHktcmVjb3JkLnYxK2pzb24gMTE1MyB7ImFsZ29yaXRobSI6ImVkMjU1MTkiLCJhcGlfdmVyc2lvbiI6InByb29mLmRldi9wcmluY2lwYWwtYmluZGluZy92MSIsImF1ZGllbmNlIjoicHJvb2Y6Ly93b3Jrc3BhY2UvMDE5YzAwMDAtMDAwMC03MDAwLTgwMDAtMDAwMDAwMDAwMDAxIiwiYXV0aGVudGljYXRlZF9zdWJqZWN0Ijp7ImFwaV92ZXJzaW9uIjoicHJvb2YuZGV2L2F1dGhlbnRpY2F0ZWQtc3ViamVjdC92MSIsInByb3ZpZGVyIjoicHJvb2YvbG9jYWwtZWQyNTUxOSIsInN1YmplY3QiOiJlZDI1NTE5OjcwN2U4ZmY2ZTRiZDQ0MjlhNTJhNTY4N2ZkNWRkYWQxMDIzODYzYWViNmNjZGQ2MTM0MjI5NTY2OWFkNTY3ZmMifSwiYXV0aG9yaXR5X3NlcXVlbmNlIjozLCJiaW5kaW5nX2lkIjoiMDE5YzAwMDAtMDAwMC03MDAwLTgwMDAtMDAwMDAwMDAwMDA0IiwiZW5yb2xsbWVudF9jaGFsbGVuZ2VfZGlnZXN0IjoiYmxha2UzOjY3YmU2NjQxYjZmODgzOGZiNDExNTg5NDZjODBlY2I2ODU0NDUyNTJkMDViNjNkZDg4YjA0ZDI4MGYzNTQ1ZTEiLCJlbnJvbGxtZW50X2VudmVsb3BlX2RpZ2VzdCI6ImJsYWtlMzo5ZTE0ZTExNTgyYWEwZjliOTRiMTA2MDgzMmI2YTA5YjUyYjgxMTkyZmIyMTVkZjVkMGE1OTBkZmUwMzA0NjUzIiwiZXhwaXJlc19hdCI6IjIwMjYtMTEtMTVUMjA6MDA6MDBaIiwiaXNzdWVkX2F0IjoiMjAyNi0wOC0xN1QyMDowMDowMFoiLCJpc3N1ZWRfYnlfcHJpbmNpcGFsX2lkIjoiMDE5YzAwMDAtMDAwMC03MDAwLTgwMDAtMDAwMDAwMDAwMDAyIiwia2V5X3VzYWdlIjoiYXV0aGVudGljYXRlZC1jb21tYW5kIiwibm90X2JlZm9yZSI6IjIwMjYtMDgtMTdUMjA6MDA6MDBaIiwicHJldmlvdXNfYXV0aG9yaXR5X3JlY29yZF9kaWdlc3QiOiJibGFrZTM6N2Q3MTY2MzdlN2Q3ZmRhMDZiNWM1MDk2NWU3ZTMwODdkY2JiMTZiNTAzNjViODE4YzhiOGE1NWY0YmYzOWRkNCIsInByaW5jaXBhbF9pZCI6IjAxOWMwMDAwLTAwMDAtNzAwMC04MDAwLTAwMDAwMDAwMDAwMyIsInByaW5jaXBhbF90eXBlIjoiYWdlbnQiLCJwdWJsaWNfa2V5IjoiY0g2UDl1UzlSQ21sS2xhSC9WM2EwUUk0WTY2MnpOMWhOQ0tWWnByVlovdz0iLCJzdXBlcnNlZGVzX2JpbmRpbmdfaWQiOm51bGwsIndvcmtzcGFjZV9pZCI6IjAxOWMwMDAwLTAwMDAtNzAwMC04MDAwLTAwMDAwMDAwMDAwMSJ9",
  "envelope_digest": "blake3:26fb2bf7e1497d581a03b846cb06e3607862f62d300406970920f09ee458ea62",
  "envelope_digest_context": "proof:authority-record-envelope:v1",
  "signers": [
    {
      "key_id": "ed25519:fefb48ca4397ebf79eeab32de62e915bddd2fbbd0bdd4105c5b14ac62737bd5b",
      "public_key_hex": "fefb48ca4397ebf79eeab32de62e915bddd2fbbd0bdd4105c5b14ac62737bd5b",
      "public_key_base64": "/vtIykOX6/ee6rMt5i6RW93S+70L3UEFxbFKxic3vVs=",
      "signature_hex": "ead4c97b17eff0f24f58fe751241db1a5a9bbbc36762d3d277f7ec4d21cb7ca8cf1252c1e56de386f07d874e052668d73e4a0278589f307852eceedb4e29d00f",
      "signature_base64": "6tTJexfv8PJPWP51EkHbGlqbu8NnYtPSd/fsTSHLfKjPElLB5W3jhvB9h04FJmjXPkoCeFifMHhS7O7bTinQDw=="
    }
  ]
}
